{
  "packet_type": "check_request",
  "version": "1.0",
  "attempt_id": "att_20250908_001",
  "student_id": "student_peshehonov",
  "question": {
    "id": "q_phys_world_01",
    "text": "Почему физический мир может иметь множество описаний? Приведите пример разных описаний какой-либо части физического мира (объекта, системы). Например, из рабочего проекта или из квартиры.",
    "course_id": "systems-thinking-101",
    "lesson_id": "lesson_01"
  },
  "answer": {
    "text": "Любая модель части физического мира фокусируется на одних свойствах и опускает другие свойства. Именно поэтому описаний может быть несколько. Например, у программного продукта может быть продающая презентация, может быть архитектурная схема, могут быть метрики в системе мониторинга. Все они описывают один и тот же программный продукт, но фокусируются на разных аспектах.",
    "submitted_at": "2025-09-08T20:28:00Z"
  },
  "metadata": {
    "guide_hint": "Глава 1, раздел 1.1",
    "expected_concepts": ["модель", "описание", "свойства", "физический мир"],
    "previous_attempts": 0
  }
}
